{
  "id": "waf-policy-default",
  "name": "Default WAF Policy",
  "description": "Standard WAF protection with OWASP-inspired rules. Starts in monitor mode for safe rollout.",
  "profile_id": "prod",
  "enabled": true,
  "mode": "monitor",
  "waf_rules": [
    "waf-rule-sqli-001",
    "waf-rule-sqli-002",
    "waf-rule-sqli-003",
    "waf-rule-sqli-004",
    "waf-rule-sqli-005",
    "waf-rule-sqli-006",
    "waf-rule-sqli-007",
    "waf-rule-xss-001",
    "waf-rule-xss-002",
    "waf-rule-xss-003",
    "waf-rule-xss-004",
    "waf-rule-xss-005",
    "waf-rule-cmdi-001",
    "waf-rule-cmdi-002",
    "waf-rule-cmdi-003",
    "waf-rule-cmdi-004",
    "waf-rule-lfi-001",
    "waf-rule-lfi-002",
    "waf-rule-proto-001",
    "waf-rule-proto-002"
  ],
  "paranoia_level": 1,
  "anomaly_threshold": 5,
  "body_inspection": true,
  "max_body_size": 1048576,
  "blocked_response": {
    "status_code": 403,
    "content_type": "text/html"
  },
  "whitelist": {
    "ips": ["127.0.0.1"],
    "paths": ["/health", "/ping", "/metrics", "/.well-known/acme-challenge/"],
    "user_agents": []
  },
  "created_at": 1740000000,
  "updated_at": 1740000000
}
